{
  "mainText": "Impulsamos a nuestro equipo a través de proyectos que usan la hospitalidad como puente, el cuidado como camino y la excelencia como estandarte.",
  "projects": [],
  "secondaryText": "A lo largo de 8 años, hemos hecho de cada detalle un acto de cuidado:\nDesde Em, Martínez, Ultramarinos Demar y Café Tormenta, hasta los proyectos que aún no existen pero ya imaginamos.\nEn 2024 Em fue otorgado su primera estrella Michelin, y Martínez reconocido en la guía Michelin, además de otros reconocimientos internacionales.",
  "tertiaryText": "Somos un colectivo de oficio y pasión que diseña lugares para quedarse más tiempo, comer rico y mirar la ciudad con otros ojos, elevando la cultura local hacia un reconocimiento global."
}
